{"artifactId":"29dc4597-875d-4c39-892d-f9f0e90abb8e","issuedUtc":"2026-03-30T17:13:51.4149841\u002B00:00","keyId":"phase4-reference-key","publicKey":"x6V9Ymt7Gc/DAvrNeYWE5xUYbZO3TZztOMRv2HGGx5U=","schema":"oan.hopng_trust_envelope","schemaVersion":"0.1.0","signatureFile":"phase4-perspectival-sample.signature.json","signer":"Reference Builder","signingScope":["phase4-perspectival-sample.hopng.json","phase4-perspectival-sample.hash.json"]}