{"artifactId":"a9038cc7-8dc5-497c-ad6f-99d477562f4d","issuedUtc":"2026-03-30T17:13:53.7277506\u002B00:00","keyId":"phase4-reference-key","publicKey":"S/9I9jDPrueB3xT0HyvaUBM4cx18WgGSqViEP017i20=","schema":"oan.hopng_trust_envelope","schemaVersion":"0.1.0","signatureFile":"phase4-restricted-perspectival.signature.json","signer":"Reference Builder","signingScope":["phase4-restricted-perspectival.hopng.json","phase4-restricted-perspectival.hash.json"]}