{"artifactId":"742c3cdd-d04d-49e8-a7f9-d783d178faac","issuedUtc":"2026-03-30T17:13:58.317223\u002B00:00","keyId":"phase4-reference-key","publicKey":"bByHidFmojf/MN4JuVTjGfZF/fcMF4jRQPGiEekFtHI=","schema":"oan.hopng_trust_envelope","schemaVersion":"0.1.0","signatureFile":"phase4-participatory-peer.signature.json","signer":"Reference Builder","signingScope":["phase4-participatory-peer.hopng.json","phase4-participatory-peer.hash.json"]}