{"artifactId":"c7f83255-d629-476f-9ce4-6228aaf71b83","issuedUtc":"2026-03-30T17:13:54.8984339\u002B00:00","keyId":"phase4-reference-key","publicKey":"UwWkoGs49Disb5o4zt7rvCPKj6tiOTqUOwMrDdrxjgU=","schema":"oan.hopng_trust_envelope","schemaVersion":"0.1.0","signatureFile":"phase4-deferred-perspectival.signature.json","signer":"Reference Builder","signingScope":["phase4-deferred-perspectival.hopng.json","phase4-deferred-perspectival.hash.json"]}