{"artifactId":"e4b06156-a3a2-428c-bafa-bd12fd0be848","issuedUtc":"2026-03-30T17:13:57.1788545\u002B00:00","keyId":"phase4-reference-key","publicKey":"M\u002B4gUxgKNG97ID7fdXDo\u002BdwJvNqKc0pzIqJYpcCa\u002B6g=","schema":"oan.hopng_trust_envelope","schemaVersion":"0.1.0","signatureFile":"phase4-participatory-sample.signature.json","signer":"Reference Builder","signingScope":["phase4-participatory-sample.hopng.json","phase4-participatory-sample.hash.json"]}