{"artifactId":"c8a81129-2a59-43c9-8332-b7af4085f5aa","issuedUtc":"2026-03-30T07:03:41.1921357\u002B00:00","keyId":"dev-key","publicKey":"CFnVkgnR\u002BLaKPJPMHGKTxUf9jLS6oMx\u002B/k5O5KOEUyk=","schema":"oan.hopng_trust_envelope","schemaVersion":"0.1.0","signatureFile":"phase3-peer-sample.signature.json","signer":"Local Tester","signingScope":["phase3-peer-sample.hopng.json","phase3-peer-sample.hash.json"]}