{"artifactId":"46634047-d451-4ffe-86f5-ee1825df8d08","issuedUtc":"2026-03-19T00:24:04.6398922\u002B00:00","keyId":"local-dev-key","publicKey":"XJP1Nr85FDIVnAv4jJHbyAz8XGTZCO0gnRJ\u002BcK/E6QU=","schema":"oan.hopng_trust_envelope","schemaVersion":"0.1.0","signatureFile":"phase3-sample.signature.json","signer":"Rober","signingScope":["phase3-sample.hopng.json","phase3-sample.hash.json"]}