{"artifactId":"f196120c-0fed-4d44-944c-0da60949710a","issuedUtc":"2026-03-30T07:50:29.6923219\u002B00:00","keyId":"local-dev-key","publicKey":"pJ6/Iyh2cVXIryVPeIoAmcYShi5nYw4mEtz/HvK79TE=","schema":"oan.hopng_trust_envelope","schemaVersion":"0.1.0","signatureFile":"phase3-divergent-peer.signature.json","signer":"Rober","signingScope":["phase3-divergent-peer.hopng.json","phase3-divergent-peer.hash.json"]}