{"artifactId":"a407d8a5-18eb-4142-947a-4eb110f86bd1","issuedUtc":"2026-03-05T23:13:38.8875642\u002B00:00","keyId":"example-key","publicKey":"onnDApN1MFbBpLigHYHj7WIkKOte9xdouXVqoQmflzE=","schema":"oan.hopng_trust_envelope","schemaVersion":"0.1.0","signatureFile":"phase1-sample.signature.json","signer":"Local Tester","signingScope":["phase1-sample.hopng.json","phase1-sample.hash.json"]}