{"artifactId":"71ee9640-daa7-4abd-8980-83bc53607f14","issuedUtc":"2026-03-30T17:13:52.5609169\u002B00:00","keyId":"phase4-reference-key","publicKey":"u9LmpBGxkIrlZAG03z6VC6FZG0f7I3xmZGW6LfG3GBQ=","schema":"oan.hopng_trust_envelope","schemaVersion":"0.1.0","signatureFile":"phase4-perspectival-peer.signature.json","signer":"Reference Builder","signingScope":["phase4-perspectival-peer.hopng.json","phase4-perspectival-peer.hash.json"]}