{"artifactId":"a543ba2e-9cc4-40aa-a2be-f6215f33c714","issuedUtc":"2026-03-30T07:33:43.2194102\u002B00:00","keyId":"dev-key","publicKey":"QTOmmxZ4E11/dBBR8XejmPjrZ3ayLHlb0mkoS3nt8pU=","schema":"oan.hopng_trust_envelope","schemaVersion":"0.1.0","signatureFile":"phase3-incompatible-basis.signature.json","signer":"Local Tester","signingScope":["phase3-incompatible-basis.hopng.json","phase3-incompatible-basis.hash.json"]}